{
  "view": "my_design",
  "plan_id": "plan:01J0000000000000000000000A",
  "input_hash": "0123456789abcdef0123456789abcdef0123456789abcdef0123456789abcdef",
  "release_id": "rel:20261001-1",
  "data_as_of": "2026-10-01",
  "budget": {
    "value_man": 15,
    "set_by_user": true,
    "min_man": 5,
    "max_man": 30,
    "step_man": 1,
    "current_paid": {
      "man": 12,
      "basis": "contract_observed",
      "as_of": "2026-09-30"
    }
  },
  "tab": "current",
  "comparison_basis_id": "cb-fixture",
  "price_caption": {
    "text": "공시 조건으로 비교 중",
    "conditions_ref": "cb-fixture"
  },
  "groups": [
    {
      "id": "diagnosis",
      "title": "진단 보장",
      "subtitle": "fixture",
      "plan_action": "add",
      "row_label": "from_plan_action",
      "price_line": {
        "basis": "illustrative",
        "man": [
          2.1,
          3.0
        ],
        "candidates": 3,
        "as_of": "2026-10-01",
        "unpriced": 0,
        "condition_match": {
          "matched": [
            "age",
            "sex"
          ],
          "mismatched": [],
          "not_in_source": [
            "channel"
          ]
        }
      },
      "coverage_occurrence_ids": [
        "cov:ted:01BX5ZZKBKACTAV9WEVGEMMVRY/art7"
      ],
      "premium_observation_ids": [
        "premium:01H8XGJWBWBAQ4Z4RN3XPQ3BDY"
      ],
      "unresolved_items": [],
      "need": {
        "verdict": "review_add",
        "reasons": [
          {
            "statement_kind": "fact",
            "text_template_id": "need-fact-1",
            "evidence": [
              "clause:seg:0123456789ab:p12-14:terms:seg-1.0/art7#p12:docproc-text@1.0"
            ],
            "assertion_refs": [
              "a:01ARZ3NDEKTSV4RRFFQ69G5FAV"
            ]
          }
        ]
      }
    },
    {
      "id": "surgery",
      "title": "입원·수술",
      "plan_action": "keep",
      "row_label": "needs_condition",
      "price_line": {
        "price_unavailable_reason": "unqueried"
      },
      "coverage_occurrence_ids": [],
      "premium_observation_ids": [],
      "unresolved_items": [
        {
          "display_status": "hold",
          "line": "fixture unresolved",
          "refs": [
            "clause:seg:0123456789ab:p12-14:terms:seg-1.0/art7#p12:docproc-text@1.0"
          ]
        }
      ]
    }
  ],
  "data_missing_count": 0,
  "unpriced_count": 1,
  "diff_available": true,
  "synthetic": true,
  "diff": {
    "groups": [
      {
        "group": "reduced",
        "items": [
          {
            "diff_type": "lose_amount",
            "amounts": [
              {
                "krw": 1000000,
                "source": "scenario:01ARZ3NDEKTSV4RRFFQ69G5FAV"
              }
            ]
          }
        ]
      }
    ]
  },
  "result_state": {
    "input_freshness": "fresh",
    "knowledge_freshness": "fresh",
    "usage_restriction": "none",
    "reproducible": true
  }
}
